{
  "id": "t1",
  "title": "Test Task",
  "description": "A test task description",
  "type": "task",
  "category": "dev",
  "tags": {"env": "prod", "team": "alpha"},
  "status": "in_progress",
  "priority": "high",
  "assigner": "alice",
  "assignee": "bob",
  "start_at": "2026-05-13T00:00:00Z",
  "end_at": "2026-05-13T00:00:00Z",
  "created_by": "alice",
  "created_at": "2026-05-13T00:00:00Z",
  "updated_by": "bob",
  "updated_at": "2026-05-13T00:00:00Z"
}
